<?xml version="1.0" encoding="UTF-8"?>
<dataroot xmlns:od="urn:schemas-microsoft-com:officedata" xmlns:xsi="http://www.w3.org/2001/XMLSchema-instance"  xsi:noNamespaceSchemaLocation="agent_to_building_levels.xsd" generated="2009-09-16T11:40:11">
<agent_to_building_levels>
<agent>middle_east_missionary</agent>
<building>enlightened_university</building>
<attribute>zeal</attribute>
<bonus>1</bonus>
<s_ColLineage>kNOq8QMAAACQ06rxBgAAAJDTqvEEAAAAkNOq8QUAAAA=
</s_ColLineage>
<s_Generation>0</s_Generation>
<s_GUID>{35A659BB-50BF-46BB-931C-C2AC6191B64F}</s_GUID>
<s_Lineage>kNOq8QcAAAAAAAAAAAAAAA==
</s_Lineage>
</agent_to_building_levels>
<agent_to_building_levels>
<agent>middle_east_missionary</agent>
<building>royal_academy</building>
<attribute>zeal</attribute>
<bonus>1</bonus>
<s_ColLineage>kNOq8QMAAACQ06rxAQAAAJDTqvEEAAAAkNOq8QUAAAA=
</s_ColLineage>
<s_Generation>0</s_Generation>
<s_GUID>{48B8D18D-FDAD-4195-95AC-5FEA130831E1}</s_GUID>
<s_Lineage>kNOq8QYAAAAAAAAAAAAAAA==
</s_Lineage>
</agent_to_building_levels>
<agent_to_building_levels>
<agent>middle_east_missionary</agent>
<building>royal_observatory</building>
<attribute>zeal</attribute>
<bonus>1</bonus>
<s_ColLineage>kNOq8QMAAACQ06rxAQAAAJDTqvEEAAAAkNOq8QUAAAA=
</s_ColLineage>
<s_Generation>0</s_Generation>
<s_GUID>{FE98F826-C2CB-4C1F-AB4E-76B8ADF458A9}</s_GUID>
<s_Lineage>kNOq8QYAAAAAAAAAAAAAAA==
</s_Lineage>
</agent_to_building_levels>
<agent_to_building_levels>
<agent>middle_east_missionary</agent>
<building>university</building>
<attribute>zeal</attribute>
<bonus>1</bonus>
<s_ColLineage>kNOq8QMAAACQ06rxBgAAAJDTqvEEAAAAkNOq8QUAAAA=
</s_ColLineage>
<s_Generation>0</s_Generation>
<s_GUID>{314C1048-7AD9-48A0-9DD1-E24DADC71FE5}</s_GUID>
<s_Lineage>kNOq8QcAAAAAAAAAAAAAAA==
</s_Lineage>
</agent_to_building_levels>
</dataroot>
